{
  "schema": "rrs.transcript/1",
  "source_id": "S004",
  "transcript_version": 1,
  "id_scheme": 1,
  "transcript_sha256": "fb230c5fccc02c3f3e105e69d79e1aace1d1805f086d7f6d3a33db0de6ebbebd",
  "timing": "none",
  "roles": {
    "JB": "guest",
    "JA": "host"
  },
  "turns": [
    {
      "id": "S004.t0001",
      "n": 1,
      "person": "JA",
      "role": "host",
      "start": null,
      "split": "window",
      "sentences": [
        {
          "id": "S004.t0001.s001",
          "episode": "S004.e01",
          "lang": "en",
          "start": null,
          "text": "hi everyone uh I'm John Adib and today I'm joined by Joe Bignell who have spent more than a decade across recruitment talent and technology",
          "norm": "hi everyone uh i m john adib and today i m joined by joe bignell who have spent more than a decade across recruitment talent and technology",
          "norm_compact": "hieveryoneuhimjohnadibandtodayimjoinedbyjoebignellwhohavespentmorethanadecadeacrossrecruitmenttalentandtechnology",
          "terms": []
        },
        {
          "id": "S004.t0001.s002",
          "episode": "S004.e01",
          "lang": "en",
          "start": null,
          "text": "and today work closely with AI and transformations so Joe great to have you here uh before we start uh I would like to ask",
          "norm": "and today work closely with ai and transformations so joe great to have you here uh before we start uh i would like to ask",
          "norm_compact": "andtodayworkcloselywithaiandtransformationssojoegreattohaveyouhereuhbeforewestartuhiwouldliketoask",
          "terms": [
            {
              "c": "AI",
              "v": "AI"
            }
          ]
        },
        {
          "id": "S004.t0001.s003",
          "episode": "S004.e01",
          "lang": "en",
          "start": null,
          "text": "you to introduce yourself and uh give us uh a bit information about your your background",
          "norm": "you to introduce yourself and uh give us uh a bit information about your your background",
          "norm_compact": "youtointroduceyourselfanduhgiveusuhabitinformationaboutyouryourbackground",
          "terms": []
        }
      ]
    },
    {
      "id": "S004.t0002",
      "n": 2,
      "person": "JB",
      "role": "guest",
      "start": null,
      "split": "window",
      "sentences": [
        {
          "id": "S004.t0002.s001",
          "episode": "S004.e01",
          "lang": "en",
          "start": null,
          "text": "yeah of course yeah thanks very much for the intro and hello everybody um so I spent 14 years in recruitment prior to doing what",
          "norm": "yeah of course yeah thanks very much for the intro and hello everybody um so i spent 14 years in recruitment prior to doing what",
          "norm_compact": "yeahofcourseyeahthanksverymuchfortheintroandhelloeverybodyumsoispent14yearsinrecruitmentpriortodoingwhat",
          "terms": []
        },
        {
          "id": "S004.t0002.s002",
          "episode": "S004.e01",
          "lang": "en",
          "start": null,
          "text": "I do today i started out recruiting telecoms engineers um across Europe Middle East and Africa so that was a lot of crossber movements a",
          "norm": "i do today i started out recruiting telecoms engineers um across europe middle east and africa so that was a lot of crossber movements a",
          "norm_compact": "idotodayistartedoutrecruitingtelecomsengineersumacrosseuropemiddleeastandafricasothatwasalotofcrossbermovementsa",
          "terms": []
        },
        {
          "id": "S004.t0002.s003",
          "episode": "S004.e01",
          "lang": "en",
          "start": null,
          "text": "lot of international movements across um different countries and different continents i then moved into IT and infrastructure and then eventually into recruiting software engineers",
          "norm": "lot of international movements across um different countries and different continents i then moved into it and infrastructure and then eventually into recruiting software engineers",
          "norm_compact": "lotofinternationalmovementsacrossumdifferentcountriesanddifferentcontinentsithenmovedintoitandinfrastructureandtheneventuallyintorecruitingsoftwareengineers",
          "terms": [
            {
              "c": "infrastructure",
              "v": "infrastructure"
            },
            {
              "c": "software engineer",
              "v": "software engineer"
            }
          ]
        },
        {
          "id": "S004.t0002.s004",
          "episode": "S004.e01",
          "lang": "en",
          "start": null,
          "text": "um so like I said EMIA was a big focus uh the US as well so I don't know the exact number but more than",
          "norm": "um so like i said emia was a big focus uh the us as well so i don t know the exact number but more than",
          "norm_compact": "umsolikeisaidemiawasabigfocusuhtheusaswellsoidontknowtheexactnumberbutmorethan",
          "terms": []
        },
        {
          "id": "S004.t0002.s005",
          "episode": "S004.e01",
          "lang": "en",
          "start": null,
          "text": "300 placements um to my name today i work for Vention so we work with tech companies and international engineering teams the bulk of our",
          "text_orig": "300 placements um to my name today i work for Venshin so we work with tech companies and international engineering teams the bulk of our",
          "norm": "300 placements um to my name today i work for vention so we work with tech companies and international engineering teams the bulk of our",
          "norm_compact": "300placementsumtomynametodayiworkforventionsoweworkwithtechcompaniesandinternationalengineeringteamsthebulkofour",
          "terms": []
        },
        {
          "id": "S004.t0002.s006",
          "episode": "S004.e01",
          "lang": "en",
          "start": null,
          "text": "engineers are across Eastern Europe and Central Asia so I still see hiring from both the candidate and the employer side even though I'm not",
          "norm": "engineers are across eastern europe and central asia so i still see hiring from both the candidate and the employer side even though i m not",
          "norm_compact": "engineersareacrosseasterneuropeandcentralasiasoistillseehiringfromboththecandidateandtheemployersideeventhoughimnot",
          "terms": []
        },
        {
          "id": "S004.t0002.s007",
          "episode": "S004.e01",
          "lang": "en",
          "start": null,
          "text": "in recruitment today we're much more in kind of AI transformation for businesses today but still with that 14 year background have a have a",
          "norm": "in recruitment today we re much more in kind of ai transformation for businesses today but still with that 14 year background have a have a",
          "norm_compact": "inrecruitmenttodayweremuchmoreinkindofaitransformationforbusinessestodaybutstillwiththat14yearbackgroundhaveahavea",
          "terms": [
            {
              "c": "AI",
              "v": "AI"
            }
          ]
        },
        {
          "id": "S004.t0002.s008",
          "episode": "S004.e01",
          "lang": "en",
          "start": null,
          "text": "good knowledge base",
          "norm": "good knowledge base",
          "norm_compact": "goodknowledgebase",
          "terms": []
        }
      ]
    },
    {
      "id": "S004.t0003",
      "n": 3,
      "person": "JA",
      "role": "host",
      "start": null,
      "split": "punctuation",
      "sentences": [
        {
          "id": "S004.t0003.s001",
          "episode": "S004.e02",
          "lang": "en",
          "start": null,
          "text": "yeah that's great so uh let's start with the classic question how long uh does a recruiter really spend the time for looking at the CV",
          "norm": "yeah that s great so uh let s start with the classic question how long uh does a recruiter really spend the time for looking at the cv",
          "norm_compact": "yeahthatsgreatsouhletsstartwiththeclassicquestionhowlonguhdoesarecruiterreallyspendthetimeforlookingatthecv",
          "terms": [
            {
              "c": "recruiter",
              "v": "recruiter"
            },
            {
              "c": "CV",
              "v": "CV"
            }
          ]
        }
      ]
    },
    {
      "id": "S004.t0004",
      "n": 4,
      "person": "JB",
      "role": "guest",
      "start": null,
      "split": "window",
      "sentences": [
        {
          "id": "S004.t0004.s001",
          "episode": "S004.e02",
          "lang": "en",
          "start": null,
          "text": "so on the first pass probably about 30 seconds and that sounds brutal but the recruiter isn't really trying to understand the entire career at",
          "norm": "so on the first pass probably about 30 seconds and that sounds brutal but the recruiter isn t really trying to understand the entire career at",
          "norm_compact": "soonthefirstpassprobablyabout30secondsandthatsoundsbrutalbuttherecruiterisntreallytryingtounderstandtheentirecareerat",
          "terms": [
            {
              "c": "recruiter",
              "v": "recruiter"
            }
          ]
        },
        {
          "id": "S004.t0004.s002",
          "episode": "S004.e02",
          "lang": "en",
          "start": null,
          "text": "that point they're trying to really establish whether that's enough relevant experience to justify carrying on reading so I guess typically I'd look at the",
          "norm": "that point they re trying to really establish whether that s enough relevant experience to justify carrying on reading so i guess typically i d look at the",